{
  "$schema": "https://json-schema.org/draft/2020-12/schema",
  "$id": "https://blauos.local/runtime/config-schema.json",
  "title": "BlauOS declarative server configuration",
  "description": "Versioned declarative description of a BlauOS server: hostname, accounts with Ed25519 SSH keys (consistent with docs/accounts.md), services within the verified launchd subset (runtime/service-subset.json), network interfaces, data volumes, image version, and fleet metadata. Validated offline by scripts/provisioning/validate_config.py.",
  "$comment": "OPEN: boot-time application of a validated configuration inside the guest, idempotent re-application with preserved data, and migrations are not implemented. Gate dependencies #59 and #60 are unresolved; a passing validation is a syntax/semantics check only and is not guest acceptance or physical-hardware evidence. Secrets never appear inline; only opaque references (vault://, file://, keychain://) are permitted and are resolved by a future secret provider.",
  "supported_config_versions": [1],
  "type": "object",
  "additionalProperties": false,
  "required": ["schema_version", "hostname"],
  "properties": {
    "schema_version": {
      "description": "Configuration format version. Only version 1 exists; unknown versions are rejected rather than silently interpreted.",
      "const": 1
    },
    "hostname": {
      "description": "RFC 1123 DNS hostname (one or more labels).",
      "type": "string",
      "minLength": 1,
      "maxLength": 253,
      "pattern": "^[a-z0-9]([a-z0-9-]{0,61}[a-z0-9])?(\\.[a-z0-9]([a-z0-9-]{0,61}[a-z0-9])?)*$"
    },
    "image": {
      "description": "Pinned OS image the configuration applies to.",
      "type": "object",
      "additionalProperties": false,
      "required": ["version"],
      "properties": {
        "channel": {"enum": ["stable", "nightly", "local"]},
        "version": {"type": "string", "minLength": 1, "maxLength": 64, "pattern": "^[0-9A-Za-z][0-9A-Za-z.+-]*$"},
        "sha256": {"type": "string", "pattern": "^[0-9a-f]{64}$", "description": "Optional pinned image digest."}
      }
    },
    "accounts": {
      "description": "Named non-root login accounts; mirrors the constraints of docs/accounts.md and scripts/vm/accounts.py (own primary group, public-key-only auth, no wheel membership, no key rotation by overwrite).",
      "type": "array",
      "maxItems": 16,
      "items": {
        "type": "object",
        "additionalProperties": false,
        "required": ["name", "uid", "gid", "ssh_authorized_keys"],
        "properties": {
          "name": {"type": "string", "pattern": "^[a-z_][a-z0-9_-]{0,31}$", "description": "Not root, nobody, or sshd."},
          "uid": {"type": "integer", "minimum": 1000, "maximum": 60000},
          "gid": {"type": "integer", "minimum": 1000, "maximum": 60000},
          "ssh_authorized_keys": {
            "description": "1-16 bare ssh-ed25519 public keys (no authorized_keys options, no private keys, no comments).",
            "type": "array",
            "minItems": 1,
            "maxItems": 16,
            "items": {"type": "string", "maxLength": 256, "pattern": "^ssh-ed25519 [A-Za-z0-9+/]+={0,2}$"}
          }
        }
      }
    },
    "services": {
      "description": "launchd jobs restricted to the verified subset in runtime/service-subset.json: RunAtLoad, KeepAlive, MachServices. GUI sessions, sandbox profiles, and arbitrary XPC compatibility are excluded and cannot be expressed.",
      "type": "array",
      "maxItems": 64,
      "items": {
        "type": "object",
        "additionalProperties": false,
        "required": ["label", "program"],
        "properties": {
          "label": {"type": "string", "maxLength": 200, "pattern": "^[A-Za-z0-9][A-Za-z0-9-]{0,62}(\\.[A-Za-z0-9][A-Za-z0-9-]{0,62})+$"},
          "program": {"type": "string", "maxLength": 1024, "pattern": "^/[A-Za-z0-9._/-]+$"},
          "program_arguments": {"type": "array", "maxItems": 32, "items": {"type": "string", "maxLength": 1024}},
          "run_at_load": {"type": "boolean"},
          "keep_alive": {"type": "boolean"},
          "mach_services": {"type": "array", "maxItems": 16, "items": {"type": "string", "maxLength": 200}}
        }
      }
    },
    "network": {
      "type": "object",
      "additionalProperties": false,
      "properties": {
        "interfaces": {
          "type": "array",
          "maxItems": 8,
          "items": {
            "type": "object",
            "additionalProperties": false,
            "required": ["name", "mode"],
            "properties": {
              "name": {"type": "string", "pattern": "^[a-z][a-z0-9]{0,15}$"},
              "mode": {"enum": ["dhcp", "static"]},
              "address": {"type": "string", "description": "IPv4 address; required for static, forbidden for dhcp."},
              "prefix_length": {"type": "integer", "minimum": 0, "maximum": 32},
              "gateway": {"type": "string", "description": "IPv4 default gateway for static mode."}
            }
          }
        },
        "dns": {"type": "array", "maxItems": 4, "items": {"type": "string"}, "description": "Up to 4 IPv4 resolver addresses."},
        "mtu": {"type": "integer", "minimum": 576, "maximum": 9000}
      }
    },
    "volumes": {
      "description": "Data volumes mounted in addition to the root filesystem. Mount points must be absolute, normalized, and distinct; volume data is preserved by any future applicator (never reformatted implicitly).",
      "type": "array",
      "maxItems": 32,
      "items": {
        "type": "object",
        "additionalProperties": false,
        "required": ["name", "device", "filesystem", "mount_point"],
        "properties": {
          "name": {"type": "string", "maxLength": 64, "pattern": "^[a-z][a-z0-9-]{0,63}$"},
          "device": {"type": "string", "maxLength": 65, "pattern": "^/dev/[A-Za-z0-9][A-Za-z0-9._/-]{0,63}$"},
          "filesystem": {"enum": ["ext4", "apfs"]},
          "mount_point": {"type": "string", "maxLength": 1024},
          "read_only": {"type": "boolean"},
          "required": {"type": "boolean", "description": "If true, boot diagnostics must fail when the volume cannot mount."}
        }
      }
    },
    "fleet": {
      "description": "Fleet membership metadata for multi-host management; informational only.",
      "type": "object",
      "additionalProperties": false,
      "properties": {
        "role": {"type": "string", "maxLength": 64, "pattern": "^[a-z0-9][a-z0-9-]{0,63}$"},
        "labels": {"type": "object", "maxProperties": 32, "additionalProperties": {"type": "string", "maxLength": 64}},
        "inventory_id": {"type": "string", "maxLength": 128}
      }
    },
    "secret_references": {
      "description": "Opaque references to secrets resolved by a future provider at apply time. Inline secret material is forbidden anywhere in the configuration.",
      "type": "array",
      "maxItems": 64,
      "items": {
        "type": "object",
        "additionalProperties": false,
        "required": ["name", "ref"],
        "properties": {
          "name": {"type": "string", "maxLength": 64, "pattern": "^[a-z][a-z0-9-]{0,63}$"},
          "ref": {"type": "string", "maxLength": 256, "pattern": "^(vault|file|keychain)://[^\\s\"']{1,251}$"}
        }
      }
    }
  }
}
